{
  "$schema": "https://json-schema.org/draft/2020-12/schema",
  "title": "ExternalEvidencePackage",
  "type": "object",
  "required": ["contract_name","contract_version","manifest_version","package_kind","package_identity","source","artifacts","external_references","configuration","configuration_identity","package_open_profile_id","checksum_algorithm","hardware_validation","limitations"],
  "properties": {
    "contract_name": {"type":"string","enum":["rttrace_external_evidence_package"]},
    "contract_version": {"type":"string"}, "manifest_version": {"type":"string","enum":["external-evidence-package-v1"]},
    "package_kind": {"type":"string","enum":["self_contained","metadata_only","referenced_external","hybrid"]},
    "package_identity": {"type":"string","pattern":"^[0-9a-f]{64}$"}, "configuration_identity": {"type":"string","pattern":"^[0-9a-f]{64}$"},
    "package_open_profile_id": {"type":"string","enum":["p7.3-package-open-only-v1"]}, "checksum_algorithm": {"type":"string","pattern":"^[a-z0-9_-]+$"}, "hardware_validation": {"type":"boolean","const":false,"enum":[false]},
    "source": {"type":"object","required":["source_id","source_kind","repository","repository_commit","source_path","source_artifact_id","source_checksum","source_bytes","rtos_name","trace_format","source_format_version","generation_mode","hardware_validation","license_spdx","acquisition_status","source_identity"],"properties":{"source_id":{"type":"string"},"source_kind":{"type":"string"},"repository":{"type":"string"},"repository_commit":{"type":"string","pattern":"^[0-9a-f]{40}$"},"source_path":{"type":"string","pattern":"^(?!/)(?![A-Za-z]:)(?!.*//)(?!.*\\\\)(?!.*(^|/)\\.\\.?(/|$)).+$"},"source_artifact_id":{"type":["string","null"]},"source_checksum":{"type":["string","null"],"pattern":"^[0-9a-f]{64}$"},"source_bytes":{"type":["integer","null"],"minimum":0},"rtos_name":{"type":"string"},"trace_format":{"type":"string"},"source_format_version":{"type":"string"},"generation_mode":{"type":"string"},"hardware_validation":{"type":"boolean","enum":[false]},"license_spdx":{"type":"string"},"acquisition_status":{"type":"string","enum":["acquired","acquisition_blocked","external_reference_only"]},"source_identity":{"type":"string","pattern":"^[0-9a-f]{64}$"}},"additionalProperties":false},
    "artifacts": {"type":"array","items":{"type":"object","required":["artifact_id","artifact_kind","relative_path","required","bytes","sha256","media_type","source_artifact_id","content_version","provenance_reference","artifact_identity"],"properties":{"artifact_id":{"type":"string"},"artifact_kind":{"type":"string"},"relative_path":{"type":"string","pattern":"^(?!/)(?![A-Za-z]:)(?!.*//)(?!.*\\\\)(?!.*(^|/)\\.\\.?(/|$)).+$"},"required":{"type":"boolean"},"bytes":{"type":"integer","minimum":0},"sha256":{"type":"string","pattern":"^[0-9a-f]{64}$"},"media_type":{"type":"string"},"source_artifact_id":{"type":"string"},"content_version":{"type":"string"},"provenance_reference":{"type":"string"},"artifact_identity":{"type":"string","pattern":"^[0-9a-f]{64}$"}},"additionalProperties":false}},
    "external_references": {"type":"array","items":{"type":"object","required":["reference_id","reference_kind","repository","repository_commit","source_path","expected_sha256","license_spdx","availability","required","source_id","reference_identity"],"properties":{"reference_id":{"type":"string"},"reference_kind":{"type":"string","enum":["provenance_license","trace_content"]},"repository":{"type":"string"},"repository_commit":{"type":"string","pattern":"^[0-9a-f]{40}$"},"source_path":{"type":"string","pattern":"^(?!/)(?![A-Za-z]:)(?!.*//)(?!.*\\\\)(?!.*(^|/)\\.\\.?(/|$)).+$"},"expected_sha256":{"type":"string","pattern":"^[0-9a-f]{64}$"},"license_spdx":{"type":"string"},"availability":{"type":"string","enum":["declared","unavailable","license_blocked"]},"required":{"type":"boolean"},"source_id":{"type":"string"},"reference_identity":{"type":"string","pattern":"^[0-9a-f]{64}$"}},"additionalProperties":false}},
    "configuration": {"type":"object","required":["validation_mode","package_profile"],"properties":{"validation_mode":{"type":"string","enum":["offline"]},"package_profile":{"type":"string","enum":["p7.3-directory-v1"]}},"additionalProperties":false},
    "limitations": {"type":"array","items":{"type":"string"}}
  },
  "additionalProperties": false
}
