{"artifacts":[{"artifact_id":"vcd_1core","artifact_identity":"12637ce0c557d385e8c5f766c835f7228a09f495ef00199d410d4ea966e32834","artifact_kind":"trace","bytes":246609,"content_version":"p7.2-source-inventory-v1","media_type":"application/octet-stream","provenance_reference":"freertos_btf_trace:vcd_1core","relative_path":"artifact/example.vcd","required":true,"sha256":"7aedcf4e14bb0e34838613225ff50e6cb8d76ed62e12bcfe16aa6101b0f36997","source_artifact_id":"vcd_1core"}],"checksum_algorithm":"sha256","configuration":{"package_profile":"p7.3-directory-v1","validation_mode":"offline"},"configuration_identity":"d564ef8750657364417e619add4bdd5889b8831c998fc9abf05514f4525eb773","contract_name":"rttrace_external_evidence_package","contract_version":"p7.3-package-open-v1","external_references":[],"hardware_validation":false,"limitations":["No semantic replay."],"manifest_version":"external-evidence-package-v1","package_identity":"7293c3a7c15d462a536a8ec84a68440ea743a6242ab8a9570470d611d890a66e","package_kind":"self_contained","package_open_profile_id":"p7.3-package-open-only-v1","source":{"acquisition_status":"acquired","generation_mode":"pre_generated_repository_sample","hardware_validation":false,"license_spdx":"MIT","repository":"https://github.com/kuopinghsu/FreeRTOS-BTF-Trace","repository_commit":"791410f5ebb05a9fdf77401228140c60275b5d27","rtos_name":"FreeRTOS","source_artifact_id":"vcd_1core","source_bytes":246609,"source_checksum":"7aedcf4e14bb0e34838613225ff50e6cb8d76ed62e12bcfe16aa6101b0f36997","source_format_version":"p7.2-source-inventory-v1","source_id":"freertos_btf_trace","source_identity":"9995a0e2d3b523588b6f2123f804fb2f5a7cd9a8a0df00fe0cac79ea1e1b2b35","source_kind":"public_pre_generated_trace","source_path":"tracedata/example.vcd","trace_format":"BTF; VCD"}}
